idx,text,label,Segment,WC,Analytic,Clout,Authentic,Tone,WPS,BigWords,Dic,Linguistic,function,pronoun,ppron,i,we,you,shehe,they,ipron,det,article,number,prep,auxverb,adverb,conj,negate,verb,adj,quantity,Drives,affiliation,achieve,power,Cognition,allnone,cogproc,insight,cause,discrep,tentat,certitude,differ,memory,Affect,tone_pos,tone_neg,emotion,emo_pos,emo_neg,emo_anx,emo_anger,emo_sad,swear,Social,socbehav,prosocial,polite,conflict,moral,comm,socrefs,family,friend,female,male,Culture,politic,ethnicity,tech,Lifestyle,leisure,home,work,money,relig,Physical,health,illness,wellness,mental,substances,sexual,food,death,need,want,acquire,lack,fulfill,fatigue,reward,risk,curiosity,allure,Perception,attention,motion,space,visual,auditory,feeling,time,focuspast,focuspresent,focusfuture,Conversation,netspeak,assent,nonflu,filler,AllPunc,Period,Comma,QMark,Exclam,Apostro,OtherP
0,im feeling rather rotten so im not very ambitious right now,0,1,11,1,1,99,1,11,18.18,100,81.82,63.64,18.18,18.18,18.18,0,0,0,0,0,0,0,0,0,18.18,36.36,9.09,9.09,18.18,18.18,0,9.09,0,9.09,0,27.27,0,27.27,9.09,0,0,9.09,0,9.09,0,9.09,0,9.09,0,0,0,0,0,0,0,0,0,0,0,0,0,0,0,0,0,0,0,0,0,0,0,0,0,0,0,0,0,0,0,0,0,0,0,0,0,0,0,0,0,0,0,0,0,0,0,18.18,9.09,0,0,0,0,0,9.09,9.09,0,27.27,0,0,0,0,0,0,0,0,0,0,0,0,0
1,im updating my blog because i feel shitty,0,1,8,1,1,99,20.23,8,25,100,75,50,37.5,37.5,37.5,0,0,0,0,0,12.5,0,0,0,12.5,0,12.5,0,25,12.5,0,0,0,0,0,25,0,25,12.5,12.5,0,0,0,0,0,12.5,0,0,0,0,0,0,0,0,12.5,0,0,0,0,0,0,0,0,0,0,0,0,12.5,0,0,12.5,0,0,0,0,0,0,0,0,0,0,0,0,0,0,0,0,0,0,0,0,0,0,0,0,12.5,12.5,0,0,0,0,0,12.5,12.5,0,25,0,0,0,0,0,0,0,0,0,0,0,0,0
2,i never make her separate from me because i don t ever want her to feel like i m ashamed with her,0,1,22,12.37,1.08,79.84,1,22,13.64,86.36,77.27,63.64,31.82,31.82,18.18,0,0,13.64,0,0,13.64,0,0,18.18,0,9.09,4.55,4.55,13.64,0,0,4.55,0,0,4.55,31.82,9.09,22.73,4.55,9.09,4.55,0,0,4.55,0,4.55,0,4.55,4.55,0,4.55,0,0,0,0,13.64,0,0,0,0,0,0,13.64,0,0,13.64,0,0,0,0,0,0,0,0,0,0,0,0,0,0,0,0,0,0,0,0,0,4.55,0,0,0,0,0,0,0,13.64,9.09,0,0,4.55,0,0,4.55,9.09,0,4.55,0,0,0,0,0,0,0,0,0,0,0,0,0
3,i left with my bouquet of red and yellow tulips under my arm feeling slightly more optimistic than when i arrived,1,1,21,42.52,1,99,88.66,21,23.81,85.71,71.43,52.38,19.05,19.05,19.05,0,0,0,0,0,14.29,0,0,19.05,0,4.76,14.29,0,4.76,19.05,4.76,0,0,0,0,9.52,0,9.52,4.76,0,0,0,0,4.76,0,4.76,4.76,0,4.76,4.76,0,0,0,0,0,0,0,0,0,0,0,0,0,0,0,0,0,0,0,0,0,0,0,0,0,0,0,4.76,0,0,0,0,0,0,0,0,0,0,0,0,0,0,0,0,0,0,28.57,0,4.76,9.52,9.52,0,4.76,4.76,4.76,0,0,0,0,0,0,0,0,0,0,0,0,0,0
4,i was feeling a little vain when i did this one,0,1,11,1,1,99,1,11,9.09,100,90.91,72.73,27.27,18.18,18.18,0,0,0,0,9.09,27.27,9.09,9.09,0,18.18,9.09,9.09,0,18.18,18.18,18.18,0,0,0,0,9.09,0,9.09,9.09,0,0,0,0,0,0,9.09,0,9.09,0,0,0,0,0,0,0,9.09,9.09,0,0,0,9.09,0,0,0,0,0,0,0,0,0,0,0,0,0,0,0,0,0,0,0,0,0,0,0,0,0,0,0,0,0,0,0,0,0,0,0,9.09,0,0,0,0,0,9.09,9.09,18.18,0,0,0,0,0,0,0,0,0,0,0,0,0,0
5,i cant walk into a shop anywhere where i do not feel uncomfortable,4,1,13,1.3,1,99,1,13,15.38,100,92.31,69.23,15.38,15.38,15.38,0,0,0,0,0,7.69,7.69,0,7.69,15.38,15.38,0,15.38,30.77,7.69,0,0,0,0,0,30.77,0,30.77,7.69,0,7.69,7.69,0,15.38,0,7.69,0,7.69,7.69,0,7.69,0,0,0,0,0,0,0,0,0,0,0,0,0,0,0,0,0,0,0,0,7.69,0,0,0,7.69,0,0,0,0,0,0,0,0,0,0,0,0,0,0,0,0,0,0,0,7.69,38.46,0,7.69,23.08,0,0,7.69,0,0,15.38,0,0,0,0,0,0,0,0,0,0,0,0,0
6,i felt anger when at the end of a telephone call,3,1,11,97.37,5.27,99,1,11,9.09,100,63.64,54.55,9.09,9.09,9.09,0,0,0,0,0,18.18,18.18,0,18.18,0,9.09,9.09,0,9.09,0,0,0,0,0,0,9.09,0,9.09,9.09,0,0,0,0,0,0,9.09,0,9.09,9.09,0,9.09,0,9.09,0,0,18.18,18.18,0,0,0,0,18.18,0,0,0,0,0,9.09,0,0,9.09,0,0,0,0,0,0,0,0,0,0,0,0,0,0,0,0,0,0,0,0,0,0,0,0,9.09,9.09,0,0,0,0,0,9.09,18.18,9.09,0,0,0,0,0,0,0,0,0,0,0,0,0,0
7,i explain why i clung to a relationship with a boy who was in many ways immature and uncommitted despite the excitement i should have been feeling for getting accepted into the masters program at the university of virginia,1,1,39,96.67,26.18,48.76,60.52,39,33.33,89.74,69.23,61.54,10.26,10.26,7.69,0,0,0,0,0,15.38,12.82,0,20.51,10.26,2.56,2.56,0,15.38,5.13,2.56,5.13,2.56,2.56,0,12.82,0,12.82,5.13,2.56,2.56,0,0,2.56,0,7.69,5.13,2.56,2.56,2.56,0,0,0,0,0,10.26,2.56,0,0,0,0,2.56,7.69,0,0,0,2.56,0,0,0,0,5.13,0,0,5.13,0,0,0,0,0,0,0,0,0,0,0,0,0,5.13,0,0,0,0,0,0,2.56,7.69,0,0,5.13,0,0,2.56,0,5.13,0,0,0,0,0,0,0,0,0,0,0,0,0,0
8,i like to have the same breathless feeling as a reader eager to see what will happen next,1,1,18,95.3,2.75,77.17,93.93,18,11.11,94.44,83.33,55.56,11.11,5.56,5.56,0,0,0,0,5.56,11.11,11.11,0,22.22,11.11,0,5.56,0,22.22,16.67,0,0,0,0,0,11.11,0,11.11,5.56,0,0,0,0,5.56,0,5.56,5.56,0,0,0,0,0,0,0,0,0,0,0,0,0,0,0,0,0,0,0,0,0,0,0,0,0,0,0,0,0,0,5.56,0,0,0,0,0,0,0,0,0,0,0,0,0,0,5.56,0,0,16.67,11.11,0,0,0,5.56,0,5.56,5.56,0,0,5.56,0,0,0,0,0,0,0,0,0,0,0,0
9,i jest i feel grumpy tired and pre menstrual which i probably am but then again its only been a week and im about as fit as a walrus on vacation for the summer,3,1,34,11.57,1,99,1.85,34,8.82,88.24,76.47,67.65,17.65,11.76,11.76,0,0,0,0,5.88,11.76,8.82,0,14.71,8.82,11.76,17.65,0,11.76,5.88,2.94,0,0,0,0,11.76,0,11.76,2.94,0,0,2.94,0,5.88,0,8.82,2.94,5.88,5.88,0,5.88,0,0,0,0,0,0,0,0,0,0,0,0,0,0,0,0,0,0,0,0,2.94,2.94,0,0,0,0,5.88,2.94,0,0,0,0,2.94,0,0,0,0,0,0,0,2.94,0,0,0,2.94,2.94,0,0,0,0,0,2.94,11.76,2.94,8.82,0,0,0,0,0,0,0,0,0,0,0,0,0
10,i don t feel particularly agitated,4,1,6,10.19,1,99,1,6,33.33,66.67,50,33.33,16.67,16.67,16.67,0,0,0,0,0,0,0,0,0,0,16.67,0,0,16.67,0,0,0,0,0,0,16.67,0,16.67,16.67,0,0,0,0,0,0,16.67,0,16.67,16.67,0,16.67,0,0,0,0,0,0,0,0,0,0,0,0,0,0,0,0,0,0,0,0,0,0,0,0,0,0,0,0,0,0,0,0,0,0,0,0,0,0,0,0,0,0,0,0,16.67,16.67,0,0,0,0,0,16.67,0,0,16.67,0,0,0,0,0,0,0,0,0,0,0,0,0
11,i feel beautifully emotional knowing that these women of whom i knew just a handful were holding me and my baba on our journey,0,1,24,5.64,40.06,97.72,83,24,25,87.5,83.33,62.5,33.33,25,16.67,4.17,0,0,0,8.33,20.83,4.17,0,8.33,4.17,8.33,4.17,0,16.67,4.17,4.17,4.17,4.17,0,0,12.5,0,12.5,12.5,0,0,0,0,0,0,8.33,4.17,0,4.17,0,0,0,0,0,0,12.5,0,0,0,0,0,0,12.5,0,0,4.17,0,0,0,0,0,0,0,0,0,0,0,0,0,0,0,0,0,0,0,0,0,0,0,0,0,0,0,0,0,4.17,4.17,0,0,0,0,0,4.17,0,8.33,4.17,0,0,0,0,0,0,0,0,0,0,0,0,0
12,i pay attention it deepens into a feeling of being invaded and helpless,4,1,13,74.95,7.93,98.89,1,13,38.46,92.31,61.54,53.85,15.38,7.69,7.69,0,0,0,0,7.69,7.69,7.69,0,15.38,7.69,0,7.69,0,7.69,7.69,0,15.38,0,0,15.38,7.69,0,7.69,7.69,0,0,0,0,0,0,7.69,0,7.69,7.69,0,7.69,0,0,0,0,7.69,7.69,0,0,7.69,0,0,0,0,0,0,0,0,0,0,0,7.69,0,0,0,7.69,0,0,0,0,0,0,0,0,0,0,0,0,0,0,0,0,0,0,0,0,30.77,7.69,0,15.38,0,0,7.69,0,0,0,0,0,0,0,0,0,0,0,0,0,0,0,0
13,i just feel extremely comfortable with the group of people that i dont even need to hide myself,1,1,18,19.76,1,39.59,93.93,18,11.11,100,83.33,66.67,22.22,16.67,16.67,0,0,0,0,5.56,11.11,5.56,0,16.67,5.56,16.67,0,5.56,16.67,5.56,0,0,0,0,0,16.67,0,16.67,5.56,0,5.56,0,5.56,0,0,5.56,5.56,0,5.56,5.56,0,0,0,0,0,5.56,0,0,0,0,0,0,5.56,0,0,0,0,0,0,0,0,0,0,0,0,0,0,0,0,0,0,0,0,0,0,0,5.56,0,0,0,0,0,0,5.56,0,16.67,11.11,0,0,0,5.56,0,5.56,0,0,11.11,0,0,0,0,0,0,0,0,0,0,0,0,0
14,i find myself in the odd position of feeling supportive of,2,1,11,99,1,99,20.23,11,27.27,100,81.82,54.55,18.18,18.18,18.18,0,0,0,0,0,9.09,9.09,0,27.27,0,0,0,0,9.09,9.09,0,9.09,9.09,0,0,27.27,0,27.27,18.18,0,0,0,0,9.09,0,18.18,9.09,9.09,0,0,0,0,0,0,0,9.09,9.09,9.09,0,0,0,0,0,0,0,0,0,0,0,0,0,0,0,0,0,0,0,0,0,0,0,0,0,0,0,0,0,0,0,0,0,0,0,0,9.09,9.09,36.36,0,0,18.18,0,0,9.09,0,0,0,0,0,0,0,0,0,0,0,0,0,0,0,0
15,i was feeling as heartbroken as im sure katniss was,0,1,10,1,1,98.38,1,10,30,90,70,60,20,20,20,0,0,0,0,0,0,0,0,20,30,0,20,0,30,10,0,0,0,0,0,10,0,10,10,0,0,0,0,0,0,10,0,10,10,0,10,0,0,10,0,0,0,0,0,0,0,0,0,0,0,0,0,0,0,0,0,0,0,0,0,0,0,0,0,0,0,0,0,0,0,0,0,0,0,0,0,0,0,0,0,10,10,0,0,0,0,0,10,0,20,10,0,0,0,0,0,0,0,0,0,0,0,0,0
16,i feel a little mellow today,1,1,6,89.52,1,99,20.23,6,0,83.33,66.67,33.33,16.67,16.67,16.67,0,0,0,0,0,16.67,16.67,0,0,0,0,0,0,16.67,16.67,16.67,0,0,0,0,16.67,0,16.67,16.67,0,0,0,0,0,0,0,0,0,0,0,0,0,0,0,0,0,0,0,0,0,0,0,0,0,0,0,0,0,0,0,0,0,0,0,0,0,0,0,0,0,0,0,0,0,0,0,0,0,0,0,0,0,0,0,0,33.33,16.67,0,0,0,0,0,16.67,0,0,16.67,0,0,0,0,0,0,0,0,0,0,0,0,0
17,i feel like my only role now would be to tear your sails with my pessimism and discontent,0,1,18,10.19,40.06,96.01,1,18,11.11,88.89,72.22,66.67,22.22,22.22,16.67,0,5.56,0,0,0,16.67,0,0,16.67,11.11,11.11,5.56,0,16.67,5.56,0,0,0,0,0,11.11,0,11.11,5.56,0,5.56,0,0,0,0,5.56,0,5.56,5.56,0,5.56,0,0,0,0,11.11,0,0,0,0,0,0,11.11,0,0,0,0,0,0,0,0,0,0,0,0,0,0,0,0,0,0,0,0,0,0,0,0,0,0,0,0,0,0,5.56,0,16.67,11.11,0,5.56,0,0,0,5.56,5.56,0,11.11,0,0,0,0,0,0,0,0,0,0,0,0,0
18,i feel just bcoz a fight we get mad to each other n u wanna make a publicity n let the world knows about our fight,3,1,26,89.52,98.04,30.98,1,26,3.85,84.62,73.08,50,15.38,15.38,3.85,7.69,3.85,0,0,0,23.08,11.54,0,11.54,0,7.69,0,0,19.23,7.69,0,7.69,7.69,0,0,19.23,0,19.23,7.69,3.85,3.85,0,0,3.85,0,11.54,0,11.54,3.85,0,3.85,0,3.85,0,0,19.23,7.69,0,0,7.69,0,0,11.54,0,0,0,0,0,0,0,0,0,0,0,0,0,0,0,0,0,0,0,0,0,0,0,0,3.85,3.85,0,0,0,0,0,0,11.54,7.69,0,0,3.85,0,0,3.85,0,0,7.69,3.85,7.69,7.69,0,0,0,0,0,0,0,0,0,0
19,i feel like reds and purples are just so rich and kind of perfect,1,1,14,7.34,9.23,24.32,99,14,14.29,85.71,78.57,57.14,7.14,7.14,7.14,0,0,0,0,0,0,0,0,14.29,7.14,14.29,21.43,0,14.29,14.29,0,7.14,0,0,7.14,28.57,0,28.57,7.14,0,0,14.29,7.14,0,0,14.29,14.29,0,0,0,0,0,0,0,0,0,0,0,0,0,0,0,0,0,0,0,0,0,0,0,0,7.14,0,0,0,7.14,0,0,0,0,0,0,0,0,0,0,0,0,0,0,0,0,0,0,0,21.43,7.14,0,0,0,0,0,7.14,0,0,14.29,0,0,0,0,0,0,0,0,0,0,0,0,0
20,im not sure the feeling of loss will ever go away but it may dull to a sweet feeling of nostalgia at what i shared in this life with my dad and the luck i had to have a dad for years,0,1,42,76.24,2.06,99,20.23,42,7.14,100,80.95,66.67,16.67,9.52,9.52,0,0,0,0,7.14,14.29,9.52,0,21.43,11.9,2.38,4.76,2.38,19.05,4.76,2.38,7.14,7.14,0,0,19.05,2.38,16.67,4.76,0,0,7.14,0,4.76,2.38,11.9,4.76,4.76,2.38,0,0,0,0,0,0,9.52,2.38,0,0,0,0,0,4.76,4.76,0,0,4.76,0,0,0,0,0,0,0,0,0,0,2.38,0,0,0,0,0,0,2.38,0,4.76,0,0,0,0,0,0,4.76,0,7.14,14.29,0,2.38,7.14,0,0,4.76,4.76,7.14,2.38,4.76,0,0,0,0,0,0,0,0,0,0,0,0
21,i feel like ive gotten to know many of you through comments and emails and for that im appreciative and glad you are a part of this little space,1,1,29,37.7,40.06,95.69,98.26,29,10.34,96.55,86.21,65.52,24.14,17.24,10.34,0,6.9,0,0,6.9,13.79,3.45,0,20.69,10.34,0,10.34,0,20.69,10.34,10.34,0,0,0,0,13.79,0,13.79,10.34,0,0,0,0,3.45,0,6.9,6.9,0,6.9,6.9,0,0,0,0,0,13.79,6.9,3.45,0,0,0,3.45,6.9,0,0,0,0,3.45,0,0,3.45,0,0,0,0,0,0,0,0,0,0,0,0,0,0,0,0,0,3.45,0,0,0,0,0,0,10.34,6.9,0,0,3.45,0,0,3.45,0,6.9,10.34,0,0,0,0,0,0,0,0,0,0,0,0,0
22,i survey my own posts over the last few years and only feel pleased with vague snippets of a few of them only feel that little bits of them capture what its like to be me or someone like me in dublin in the st century,1,1,46,82.28,18.24,96.69,53.96,46,10.87,89.13,80.43,65.22,21.74,13.04,8.7,0,0,0,4.35,8.7,17.39,6.52,0,21.74,2.17,4.35,4.35,0,6.52,15.22,10.87,4.35,0,0,4.35,10.87,0,10.87,4.35,0,0,6.52,0,2.17,0,2.17,2.17,0,2.17,2.17,0,0,0,0,0,8.7,2.17,0,0,0,0,2.17,6.52,0,0,0,0,0,0,0,0,0,0,0,0,0,0,0,0,0,0,0,0,0,0,0,0,0,2.17,0,0,0,0,0,0,8.7,10.87,0,0,6.52,0,0,4.35,6.52,0,4.35,0,0,0,0,0,0,0,0,0,0,0,0,0
23,i also tell you in hopes that anyone who is still feeling stigmatized or ashamed of their mental health issues will let go of the stigma let go of the shame,0,1,31,41.62,88.59,79.1,1.4,31,9.68,90.32,77.42,54.84,19.35,12.9,3.23,0,3.23,0,3.23,6.45,12.9,6.45,0,12.9,6.45,6.45,6.45,0,25.81,0,0,3.23,0,0,3.23,16.13,0,16.13,3.23,0,3.23,9.68,0,3.23,0,9.68,3.23,6.45,9.68,3.23,6.45,0,0,0,0,19.35,6.45,0,0,0,3.23,3.23,12.9,0,0,0,0,0,0,0,0,0,0,0,0,0,0,6.45,6.45,0,0,6.45,0,0,0,0,0,3.23,0,0,0,0,0,0,0,9.68,12.9,0,6.45,9.68,0,0,3.23,0,0,6.45,6.45,0,0,0,0,0,0,0,0,0,0,0,0
24,i don t feel guilty like i m not going to be able to cook for him,0,1,17,79.1,1,83.69,1,17,0,82.35,64.71,52.94,17.65,17.65,11.76,0,0,5.88,0,0,0,0,0,23.53,5.88,0,0,5.88,23.53,0,0,5.88,0,5.88,0,17.65,0,17.65,11.76,0,0,0,0,5.88,0,11.76,0,11.76,11.76,0,11.76,0,0,11.76,0,5.88,0,0,0,0,0,0,5.88,0,0,0,5.88,0,0,0,0,0,0,0,0,0,0,5.88,0,0,0,0,0,0,5.88,0,0,0,0,0,0,0,0,0,0,5.88,0,0,0,0,0,0,0,0,0,11.76,11.76,0,0,0,0,0,0,0,0,0,0,0,0
25,i hate it when i feel fearful for absolutely no reason,4,1,11,1,1,99,1,11,18.18,100,90.91,63.64,27.27,18.18,18.18,0,0,0,0,9.09,9.09,0,0,9.09,0,18.18,9.09,9.09,18.18,9.09,0,0,0,0,0,36.36,9.09,27.27,18.18,9.09,0,0,9.09,0,0,18.18,0,18.18,18.18,0,18.18,9.09,9.09,0,0,0,0,0,0,0,0,0,0,0,0,0,0,0,0,0,0,0,0,0,0,0,0,0,0,0,0,0,0,0,0,0,0,0,0,0,0,0,0,0,0,18.18,9.09,0,0,0,0,0,9.09,9.09,0,9.09,0,9.09,0,9.09,0,0,0,0,0,0,0,0,0
26,i am feeling outraged it shows everywhere,3,1,7,1,1,99,1,7,42.86,85.71,57.14,57.14,28.57,14.29,14.29,0,0,0,0,14.29,0,0,0,0,14.29,14.29,0,0,14.29,0,0,0,0,0,0,28.57,14.29,14.29,14.29,0,0,0,0,0,0,14.29,0,14.29,14.29,0,14.29,0,14.29,0,0,0,0,0,0,0,0,0,0,0,0,0,0,0,0,0,0,0,0,0,0,0,0,0,0,0,0,0,0,0,0,0,0,0,0,0,0,0,0,0,0,0,28.57,0,0,14.29,0,0,14.29,0,0,14.29,0,0,0,0,0,0,0,0,0,0,0,0,0
27,i stole a book from one of my all time favorite authors and now i feel like a rotten person,0,1,20,89.52,3.95,89.39,20.23,20,10,95,80,60,15,15,15,0,0,0,0,0,25,10,5,15,0,5,5,0,10,10,10,0,0,0,0,10,5,5,5,0,0,0,0,0,0,10,5,5,0,0,0,0,0,0,0,5,0,0,0,0,0,0,5,0,0,0,0,0,0,0,0,5,0,0,5,0,0,0,0,0,0,0,0,0,0,0,0,0,5,0,0,0,0,0,0,20,5,0,0,0,0,0,5,5,5,10,0,0,0,0,0,0,0,0,0,0,0,0,0
28,i do feel insecure sometimes but who doesnt,4,1,8,1,1,99,1,8,25,100,87.5,62.5,25,25,12.5,0,0,0,0,0,0,0,0,0,25,0,12.5,12.5,37.5,12.5,0,0,0,0,0,37.5,0,37.5,12.5,0,0,12.5,0,12.5,0,12.5,0,12.5,12.5,0,12.5,12.5,0,0,0,12.5,0,0,0,0,0,0,12.5,0,0,0,0,0,0,0,0,0,0,0,0,0,0,0,0,0,0,0,0,0,0,0,0,0,0,0,0,0,0,0,0,12.5,12.5,0,0,0,0,0,12.5,12.5,0,25,0,0,0,0,0,0,0,0,0,0,0,0,0
29,i highly recommend visiting on a wednesday if youre able because its less crowded so you get to ask the farmers more questions without feeling rude for holding up a line,3,1,31,77.83,59.25,97.57,20.23,31,32.26,90.32,70.97,54.84,12.9,9.68,3.23,0,6.45,0,0,3.23,19.35,9.68,0,16.13,3.23,6.45,9.68,0,12.9,9.68,6.45,3.23,0,3.23,0,16.13,0,16.13,6.45,3.23,0,6.45,0,6.45,0,6.45,3.23,3.23,3.23,0,3.23,0,3.23,0,0,19.35,12.9,0,0,3.23,0,3.23,6.45,0,0,0,0,0,0,0,0,0,0,0,0,0,0,0,0,0,0,0,0,0,0,0,0,0,3.23,0,0,0,0,0,0,3.23,12.9,0,0,9.68,0,0,3.23,3.23,0,3.23,0,0,0,0,0,0,0,0,0,0,0,0,0
30,ive been missing him and feeling so restless at home thinking of him,4,1,13,1.3,81.78,30.98,1,13,30.77,92.31,76.92,61.54,23.08,23.08,7.69,0,0,15.38,0,0,0,0,0,15.38,15.38,7.69,15.38,0,23.08,7.69,0,0,0,0,0,15.38,0,15.38,15.38,0,0,0,0,0,0,7.69,0,7.69,7.69,0,7.69,7.69,0,0,0,15.38,0,0,0,0,0,0,15.38,0,0,0,15.38,0,0,0,0,7.69,0,7.69,0,0,0,0,0,0,0,0,0,0,0,0,0,0,0,0,0,0,0,0,0,0,15.38,0,0,7.69,0,0,7.69,0,15.38,0,0,0,0,0,0,0,0,0,0,0,0,0,0
31,i posted on my facebook page earlier this week ive been feeling a little grumpy and out of sorts the past few days,3,1,23,72.44,1.4,99,1,23,13.04,91.3,78.26,52.17,17.39,13.04,13.04,0,0,0,0,4.35,21.74,8.7,0,13.04,8.7,0,4.35,0,13.04,17.39,17.39,0,0,0,0,8.7,0,8.7,4.35,0,0,4.35,0,0,0,4.35,0,4.35,4.35,0,4.35,0,0,0,0,4.35,4.35,0,0,0,0,0,0,0,0,0,0,0,0,0,0,0,0,0,0,0,0,0,0,0,0,0,0,0,0,0,0,0,0,0,0,0,0,0,0,4.35,8.7,0,0,4.35,0,0,4.35,17.39,21.74,0,0,0,0,0,0,0,0,0,0,0,0,0,0
32,i start to feel emotional,0,1,5,89.52,1,99,20.23,5,20,100,100,40,20,20,20,0,0,0,0,0,0,0,0,20,0,0,0,0,40,20,0,0,0,0,0,20,0,20,20,0,0,0,0,0,0,20,0,0,20,0,0,0,0,0,0,0,0,0,0,0,0,0,0,0,0,0,0,0,0,0,0,0,0,0,0,0,0,0,0,0,0,0,0,0,0,0,0,0,0,0,0,0,0,0,0,40,20,0,0,0,0,0,20,20,0,20,0,0,0,0,0,0,0,0,0,0,0,0,0
33,i feel so cold a href http irish,3,1,8,26.1,1.71,89.39,20.23,8,0,87.5,62.5,37.5,12.5,12.5,12.5,0,0,0,0,0,12.5,12.5,0,0,0,12.5,12.5,0,12.5,12.5,0,0,0,0,0,12.5,0,12.5,12.5,0,0,0,0,0,0,0,0,0,0,0,0,0,0,0,0,0,0,0,0,0,0,0,0,0,0,0,0,25,0,12.5,12.5,0,0,0,0,0,0,0,0,0,0,0,0,0,0,0,0,0,0,0,0,0,0,0,0,12.5,25,0,0,0,0,0,25,0,0,12.5,0,0,0,0,0,0,0,0,0,0,0,0,0
34,i feel like i m defective or something for not having baby fever,0,1,13,14.06,1,99,20.23,13,15.38,84.62,69.23,61.54,23.08,15.38,15.38,0,0,0,0,7.69,0,0,0,15.38,7.69,0,7.69,7.69,15.38,0,0,0,0,0,0,30.77,0,30.77,7.69,0,0,15.38,0,15.38,0,0,0,0,0,0,0,0,0,0,0,7.69,0,0,0,0,0,0,7.69,7.69,0,0,0,0,0,0,0,0,0,0,0,0,0,7.69,7.69,7.69,0,0,0,0,0,0,0,0,0,0,0,0,0,0,0,15.38,7.69,0,0,0,0,0,7.69,0,0,7.69,0,0,0,0,0,0,0,0,0,0,0,0,0
35,i feel more virtuous than when i eat veggies dipped in hummus,1,1,12,26.1,1,99,99,12,16.67,91.67,66.67,50,16.67,16.67,16.67,0,0,0,0,0,8.33,0,0,16.67,0,8.33,16.67,0,16.67,8.33,8.33,0,0,0,0,16.67,0,16.67,8.33,0,0,0,0,8.33,0,8.33,8.33,0,0,0,0,0,0,0,0,8.33,8.33,0,0,0,8.33,0,0,0,0,0,0,0,0,0,0,0,0,0,0,0,0,25,0,0,0,0,0,0,25,0,0,0,0,0,0,0,0,0,0,8.33,16.67,0,0,8.33,0,0,8.33,8.33,0,8.33,0,0,0,0,0,0,0,0,0,0,0,0,0
36,i feel very honoured to be included in a magzine which prioritises health and clean living so highly im curious do any of you read magazines concerned with health and clean lifestyles such as the green parent,1,1,37,51.04,40.06,55.76,93.12,37,21.62,86.49,72.97,51.35,10.81,8.11,5.41,0,2.7,0,0,2.7,10.81,5.41,0,13.51,8.11,5.41,10.81,0,18.92,10.81,0,5.41,2.7,2.7,0,13.51,0,13.51,5.41,0,0,2.7,0,2.7,0,8.11,5.41,0,2.7,0,0,0,0,0,0,8.11,2.7,0,2.7,0,2.7,0,5.41,2.7,0,0,0,0,0,0,0,0,0,0,0,0,0,8.11,5.41,0,0,0,0,0,0,0,0,0,0,0,0,0,0,0,2.7,8.11,10.81,0,0,5.41,2.7,0,2.7,0,2.7,5.41,0,0,0,0,0,0,0,0,0,0,0,0,0
37,i spent the last two weeks of school feeling miserable,0,1,10,97.77,3.95,99,1,10,20,100,70,40,10,10,10,0,0,0,0,0,20,10,10,10,0,0,0,0,10,10,20,0,0,0,0,10,0,10,10,0,0,0,0,0,0,10,0,10,10,0,10,0,0,0,0,0,0,0,0,0,0,0,0,0,0,0,0,0,0,0,0,20,0,0,10,10,0,0,0,0,0,0,0,0,0,0,0,0,0,0,0,0,0,0,0,0,10,0,0,0,0,0,10,20,10,0,0,0,0,0,0,0,0,0,0,0,0,0,0
38,im feeling very peaceful about our wedding again now after having,1,1,11,1,99,99,99,11,27.27,100,81.82,72.73,18.18,18.18,9.09,9.09,0,0,0,0,9.09,0,0,18.18,18.18,36.36,9.09,0,18.18,9.09,0,18.18,18.18,0,0,9.09,0,9.09,9.09,0,0,0,0,0,0,9.09,9.09,0,0,0,0,0,0,0,0,18.18,9.09,0,0,0,0,0,18.18,9.09,0,0,0,0,0,0,0,0,0,0,0,0,0,0,0,0,0,0,0,0,0,0,0,0,0,0,0,0,0,0,0,9.09,9.09,0,0,0,0,0,9.09,27.27,0,18.18,0,0,0,0,0,0,0,0,0,0,0,0,0
39,i had been talking to coach claudia barcomb and coach ali boe for a long time and they both made me feel very welcomed at union,1,1,26,53.56,20.31,30.98,79.29,26,15.38,84.62,65.38,50,11.54,11.54,7.69,0,0,0,3.85,0,7.69,3.85,0,11.54,7.69,3.85,7.69,0,19.23,3.85,7.69,15.38,7.69,0,7.69,7.69,0,7.69,3.85,3.85,0,0,0,0,0,3.85,3.85,0,0,0,0,0,0,0,0,11.54,7.69,0,3.85,0,0,3.85,3.85,0,0,0,0,0,0,0,0,0,0,0,0,0,0,0,0,0,0,0,0,0,0,0,0,0,0,0,0,0,0,0,0,11.54,7.69,0,0,3.85,0,0,3.85,0,11.54,3.85,0,0,0,0,0,0,0,0,0,0,0,0,0
40,i feel if i completely hated things i d exercise my democratic right speak my mind in what ever ways possible and try to enact a change,3,1,27,16.08,1,99,20.23,27,14.81,88.89,77.78,51.85,25.93,18.52,18.52,0,0,0,0,7.41,11.11,3.7,0,7.41,0,7.41,7.41,0,18.52,7.41,0,3.7,0,3.7,0,33.33,3.7,29.63,3.7,7.41,3.7,7.41,3.7,3.7,0,7.41,3.7,3.7,3.7,0,3.7,0,3.7,0,0,3.7,3.7,0,0,0,0,3.7,0,0,0,0,0,3.7,3.7,0,0,0,0,0,0,0,0,0,0,0,0,0,0,0,0,0,0,0,0,0,0,0,0,0,0,11.11,7.41,0,0,3.7,0,0,3.7,7.41,3.7,3.7,0,0,0,0,0,0,0,0,0,0,0,0,0
41,i feel humiliated embarrassed or foolish i will remember that others have felt the same way because of the same kinds of things and i will be kind and helpful and accepting,0,1,32,8.85,1,99,20.23,32,21.88,96.88,81.25,59.38,18.75,9.38,9.38,0,0,0,0,9.38,9.38,6.25,0,6.25,12.5,0,15.63,0,25,9.38,0,3.13,0,0,3.13,28.13,0,28.13,9.38,3.13,0,3.13,0,15.63,3.13,12.5,6.25,6.25,6.25,0,6.25,0,0,0,0,9.38,9.38,3.13,0,3.13,0,0,0,0,0,0,0,0,0,0,0,0,0,0,0,0,0,0,0,0,0,0,0,0,0,0,0,0,3.13,0,0,0,0,0,0,6.25,9.38,0,0,3.13,0,0,6.25,0,9.38,3.13,6.25,0,0,0,0,0,0,0,0,0,0,0,0
42,i feel reassured that i am dealing with my diet in the right way and that all is good,1,1,19,22.98,1,99,99,19,10.53,100,68.42,63.16,26.32,15.79,15.79,0,0,0,0,10.53,26.32,5.26,0,10.53,10.53,0,5.26,0,15.79,0,5.26,0,0,0,0,10.53,5.26,5.26,5.26,0,0,0,0,0,0,10.53,10.53,0,5.26,5.26,0,0,0,0,0,5.26,5.26,0,0,0,0,0,0,0,0,0,0,0,0,0,0,5.26,0,0,5.26,0,0,5.26,5.26,0,5.26,0,0,0,0,0,0,0,0,0,0,0,0,0,0,15.79,15.79,0,0,10.53,0,0,5.26,0,0,15.79,0,0,0,0,0,0,0,0,0,0,0,0,0
43,i feel i have to agree with her even though i can imagine some rather unpleasant possible cases,0,1,18,1.78,1,77.17,1,18,16.67,94.44,88.89,66.67,22.22,22.22,16.67,0,0,5.56,0,0,11.11,0,0,11.11,11.11,16.67,5.56,0,22.22,11.11,5.56,0,0,0,0,33.33,0,33.33,11.11,0,5.56,11.11,0,5.56,0,5.56,0,5.56,5.56,0,5.56,0,0,0,0,11.11,5.56,0,0,0,0,0,5.56,0,0,5.56,0,0,0,0,0,0,0,0,0,0,0,0,0,0,0,0,0,0,0,0,11.11,0,0,0,0,0,0,0,0,5.56,5.56,0,0,0,0,0,5.56,0,0,11.11,11.11,5.56,0,5.56,0,0,0,0,0,0,0,0,0
44,im in such a happy mood today i feel almost delighted and i havent done anything different today then i normally have it is wonderful,1,1,25,1,1,99,99,25,20,100,84,68,24,16,16,0,0,0,0,8,8,4,0,4,20,8,8,4,24,12,0,0,0,0,0,24,0,24,4,0,4,8,0,8,0,16,12,0,16,12,0,0,0,0,0,0,0,0,0,0,0,0,0,0,0,0,0,0,0,0,0,0,0,0,0,0,0,0,0,0,0,0,0,0,0,0,0,0,0,0,0,0,0,0,0,16,8,0,0,4,0,0,4,4,4,12,0,0,0,0,0,0,0,0,0,0,0,0,0
45,im feeling really out of place and irritated,3,1,8,26.1,1.71,99,1,8,25,100,62.5,62.5,12.5,12.5,12.5,0,0,0,0,0,0,0,0,25,12.5,12.5,12.5,0,12.5,0,0,0,0,0,0,25,0,25,12.5,0,0,0,12.5,0,0,12.5,0,12.5,12.5,0,12.5,0,12.5,0,0,0,0,0,0,0,0,0,0,0,0,0,0,0,0,0,0,0,0,0,0,0,0,0,0,0,0,0,0,0,0,0,0,0,0,0,0,0,0,0,0,25,37.5,0,0,25,0,0,12.5,0,0,12.5,0,0,0,0,0,0,0,0,0,0,0,0,0
46,i also know that i feel nothing than a friendly affection to them too,1,1,14,2.35,1,99,99,14,21.43,100,92.86,71.43,28.57,21.43,14.29,0,0,0,7.14,7.14,14.29,7.14,0,14.29,0,14.29,14.29,7.14,14.29,7.14,0,14.29,14.29,0,0,28.57,7.14,21.43,14.29,0,0,0,0,7.14,0,14.29,14.29,0,14.29,14.29,0,0,0,0,0,21.43,14.29,14.29,0,0,0,0,7.14,0,0,0,0,0,0,0,0,0,0,0,0,0,0,0,0,0,0,0,0,0,0,0,0,0,0,0,0,0,0,0,0,14.29,7.14,0,0,0,0,0,7.14,0,0,7.14,0,0,0,0,0,0,0,0,0,0,0,0,0
47,i feel like i had a rather productive weekend and i cant always say that no matter how much i get done,1,1,22,1,1,99,20.23,22,9.09,100,90.91,72.73,22.73,18.18,18.18,0,0,0,0,4.55,18.18,4.55,0,4.55,13.64,13.64,4.55,9.09,27.27,9.09,4.55,4.55,0,4.55,0,31.82,9.09,22.73,9.09,4.55,4.55,4.55,0,4.55,0,0,0,0,0,0,0,0,0,0,0,4.55,4.55,0,0,0,0,4.55,0,0,0,0,0,0,0,0,0,9.09,4.55,0,4.55,0,0,0,0,0,0,0,0,0,0,0,0,0,4.55,0,0,0,0,0,0,18.18,4.55,0,0,0,0,0,4.55,9.09,9.09,9.09,0,0,0,0,0,0,0,0,0,0,0,0,0
48,im feeling insecure at the moment,4,1,6,89.52,1,99,1,6,33.33,100,66.67,50,16.67,16.67,16.67,0,0,0,0,0,16.67,16.67,0,16.67,16.67,0,0,0,16.67,16.67,0,0,0,0,0,16.67,0,16.67,16.67,0,0,0,0,0,0,16.67,0,16.67,16.67,0,16.67,16.67,0,0,0,0,0,0,0,0,0,0,0,0,0,0,0,0,0,0,0,0,0,0,0,0,0,0,0,0,0,0,0,0,0,0,0,0,0,0,0,0,0,0,0,0,16.67,0,0,0,0,0,16.67,16.67,0,16.67,0,0,0,0,0,0,0,0,0,0,0,0,0
49,i was feeling pretty anxious all day but my first day at work was a very good day and that helped a lot,4,1,23,23.51,1.4,98.67,84.9,23,8.7,100,86.96,65.22,13.04,8.7,8.7,0,0,0,0,4.35,30.43,8.7,4.35,4.35,8.7,8.7,8.7,0,13.04,13.04,26.09,8.7,4.35,4.35,0,17.39,4.35,13.04,4.35,0,0,4.35,0,4.35,0,13.04,8.7,4.35,8.7,4.35,4.35,4.35,0,0,0,4.35,4.35,4.35,0,0,0,0,0,0,0,0,0,0,0,0,0,4.35,0,0,4.35,0,0,0,0,0,0,0,0,0,0,0,0,0,0,0,0,0,0,0,0,26.09,4.35,0,0,0,0,0,4.35,13.04,13.04,0,0,0,0,0,0,0,0,0,0,0,0,0,0
50,i stood up to you i finally stood up to you and now i feel like im being punished if i could go back and do it again,0,1,28,1.23,9.23,99,1,28,7.14,100,96.43,78.57,28.57,25,17.86,0,7.14,0,0,3.57,0,0,0,17.86,14.29,10.71,10.71,0,32.14,0,0,3.57,0,0,3.57,10.71,0,10.71,3.57,0,3.57,3.57,0,3.57,0,3.57,0,3.57,0,0,0,0,0,0,0,10.71,3.57,0,0,0,0,0,7.14,0,0,0,0,0,0,0,0,0,0,0,0,0,0,0,0,0,0,0,0,0,0,0,0,0,0,0,0,0,0,0,0,17.86,25,0,3.57,21.43,0,0,3.57,10.71,10.71,10.71,0,0,0,0,0,0,0,0,0,0,0,0,0
51,i feel a little nervous i go to the gym,4,1,10,97.77,1,99,1,10,10,100,90,50,20,20,20,0,0,0,0,0,20,20,0,10,0,0,0,0,20,20,10,0,0,0,0,10,0,10,10,0,0,0,0,0,0,10,0,10,10,0,10,10,0,0,0,0,0,0,0,0,0,0,0,0,0,0,0,0,0,0,0,10,10,0,0,0,0,10,10,0,10,0,0,0,0,0,0,0,0,0,0,0,0,0,0,20,20,0,10,10,0,0,10,0,0,10,0,0,0,0,0,0,0,0,0,0,0,0,0
52,i feel like i could go into any situation and become successful because i ve been competing all my life explained schaub in an interview with the a href http bleacherreport,1,1,31,84.4,1.48,97.57,70.91,31,22.58,87.1,70.97,54.84,12.9,12.9,12.9,0,0,0,0,0,19.35,9.68,0,12.9,6.45,0,6.45,0,19.35,3.23,3.23,6.45,0,6.45,3.23,25.81,3.23,22.58,6.45,3.23,3.23,3.23,0,0,0,3.23,3.23,0,0,0,0,0,0,0,0,9.68,6.45,0,0,0,0,3.23,0,0,0,0,0,3.23,0,0,3.23,3.23,0,0,3.23,0,0,0,0,0,0,0,0,0,0,0,0,0,0,0,0,0,3.23,0,0,12.9,12.9,0,3.23,9.68,0,0,3.23,0,6.45,3.23,0,0,0,0,0,0,0,0,0,0,0,0,0
53,i can t stop the anxiety i feel when i m alone when i ve got no distractions,0,1,18,1,1,99,1,18,11.11,83.33,66.67,55.56,22.22,22.22,22.22,0,0,0,0,0,11.11,5.56,0,0,5.56,16.67,11.11,5.56,16.67,5.56,0,0,0,0,0,16.67,5.56,11.11,5.56,0,5.56,0,0,0,0,5.56,0,5.56,5.56,0,5.56,5.56,0,0,0,5.56,0,0,0,0,0,0,0,0,0,0,0,0,0,0,0,0,0,0,0,0,0,0,0,0,0,0,0,0,0,0,0,0,5.56,0,0,0,0,0,0,16.67,11.11,5.56,0,0,0,0,5.56,16.67,0,11.11,0,0,0,0,0,0,0,0,0,0,0,0,0
54,im trying to feel out my house style now that im living on my own and have creative carte blanche,1,1,20,8.11,1,99,20.23,20,10,85,75,55,25,20,20,0,0,0,0,5,15,0,0,15,15,5,5,0,30,5,0,15,0,10,5,10,0,10,5,0,5,0,0,0,0,0,0,0,0,0,0,0,0,0,0,0,0,0,0,0,0,0,0,0,0,0,0,0,0,0,0,5,0,5,0,0,0,5,0,0,0,0,0,0,0,0,0,0,0,0,0,0,0,0,5,20,15,0,0,10,0,0,5,5,0,20,0,0,0,0,0,0,0,0,0,0,0,0,0
55,i have tried to see what it would be like if i liked one of my girl friends but it has never really worked and i can only ever feel an emotional connection to them because they are my friends,0,1,40,1,15.75,78.67,59.44,40,12.5,100,90,75,25,17.5,12.5,0,0,0,5,7.5,10,2.5,2.5,10,15,10,10,2.5,27.5,5,2.5,10,5,5,0,22.5,5,17.5,2.5,2.5,5,2.5,2.5,5,0,5,2.5,0,2.5,0,0,0,0,0,0,17.5,0,0,0,0,0,0,15,0,10,5,0,0,0,0,0,2.5,0,0,2.5,0,0,0,0,0,0,0,0,0,0,0,0,0,0,0,0,0,0,0,0,10,7.5,0,0,2.5,2.5,0,2.5,5,7.5,10,0,0,0,0,0,0,0,0,0,0,0,0,0
