idx,text,label,Segment,WC,Analytic,Clout,Authentic,Tone,WPS,BigWords,Dic,Linguistic,function,pronoun,ppron,i,we,you,shehe,they,ipron,det,article,number,prep,auxverb,adverb,conj,negate,verb,adj,quantity,Drives,affiliation,achieve,power,Cognition,allnone,cogproc,insight,cause,discrep,tentat,certitude,differ,memory,Affect,tone_pos,tone_neg,emotion,emo_pos,emo_neg,emo_anx,emo_anger,emo_sad,swear,Social,socbehav,prosocial,polite,conflict,moral,comm,socrefs,family,friend,female,male,Culture,politic,ethnicity,tech,Lifestyle,leisure,home,work,money,relig,Physical,health,illness,wellness,mental,substances,sexual,food,death,need,want,acquire,lack,fulfill,fatigue,reward,risk,curiosity,allure,Perception,attention,motion,space,visual,auditory,feeling,time,focuspast,focuspresent,focusfuture,Conversation,netspeak,assent,nonflu,filler,AllPunc,Period,Comma,QMark,Exclam,Apostro,OtherP
996,i replied feeling strange at giving the orders,5,1,8,98.55,1.71,89.39,20.23,8,37.5,100,62.5,37.5,12.5,12.5,12.5,0,0,0,0,0,12.5,12.5,0,12.5,0,0,0,0,12.5,12.5,0,12.5,0,0,12.5,12.5,0,12.5,12.5,0,0,0,0,0,0,0,0,0,0,0,0,0,0,0,0,12.5,12.5,0,0,0,0,12.5,0,0,0,0,0,0,0,0,0,0,0,0,0,0,0,0,0,0,0,0,0,0,0,0,0,0,0,0,0,0,0,0,12.5,0,12.5,0,0,0,0,0,12.5,0,0,0,0,0,0,0,0,0,0,0,0,0,0,0,0
997,i chant the invocation and feel his force supporting me as i teach,1,1,13,14.06,1,81.58,20.23,13,15.38,76.92,61.54,53.85,30.77,30.77,23.08,0,0,7.69,0,0,15.38,7.69,0,7.69,0,0,15.38,0,7.69,0,0,7.69,0,0,7.69,15.38,0,15.38,7.69,7.69,0,0,0,0,0,0,0,0,0,0,0,0,0,0,0,15.38,7.69,0,0,0,0,0,7.69,0,0,0,7.69,0,0,0,0,7.69,0,0,7.69,0,0,0,0,0,0,0,0,0,0,0,0,0,0,0,0,0,0,0,0,7.69,7.69,0,0,0,0,0,7.69,0,0,7.69,0,0,0,0,0,0,0,0,0,0,0,0,0
998,i feel like he moves sleep i am glad i enjoyed that week of good sleep that i mentioned because i have a feeling that is over with now,1,1,29,13.62,1,99,99,29,13.79,100,75.86,65.52,31.03,20.69,17.24,0,0,3.45,0,10.34,13.79,3.45,0,13.79,10.34,3.45,3.45,0,13.79,3.45,3.45,0,0,0,0,10.34,0,10.34,6.9,3.45,0,0,0,0,0,10.34,10.34,0,10.34,10.34,0,0,0,0,0,6.9,3.45,0,0,0,0,3.45,3.45,0,0,0,3.45,0,0,0,0,0,0,0,0,0,0,6.9,0,0,0,0,0,0,0,0,0,0,0,0,0,0,0,0,0,17.24,13.79,0,3.45,3.45,0,0,6.9,6.9,3.45,13.79,0,0,0,0,0,0,0,0,0,0,0,0,0
999,i am really hurt and i feel unimportant and that sucks,0,1,11,1,1,95.15,1,11,9.09,100,90.91,63.64,27.27,18.18,18.18,0,0,0,0,9.09,9.09,0,0,0,9.09,9.09,18.18,0,27.27,9.09,0,0,0,0,0,18.18,0,18.18,9.09,0,0,0,9.09,0,0,18.18,0,18.18,9.09,0,9.09,0,0,0,0,0,0,0,0,0,0,0,0,0,0,0,0,0,0,0,0,0,0,0,0,0,0,9.09,0,0,0,0,0,0,0,0,0,0,0,0,0,0,0,0,0,9.09,18.18,0,0,0,0,0,18.18,0,0,18.18,0,0,0,0,0,0,0,0,0,0,0,0,0
1000,i grew up around this feeling living only minutes away from the gorgeous atlantic ocean in brazil so its probably no surprise i grew fond of the ocean,1,1,28,76.24,3.12,99,98.65,28,21.43,85.71,78.57,57.14,14.29,7.14,7.14,0,0,0,0,7.14,17.86,7.14,0,21.43,0,14.29,3.57,3.57,10.71,10.71,3.57,0,0,0,0,10.71,3.57,7.14,3.57,0,0,3.57,0,0,0,10.71,7.14,0,7.14,3.57,0,0,0,0,0,3.57,3.57,3.57,0,0,0,0,0,0,0,0,0,0,0,0,0,0,0,0,0,0,0,3.57,0,0,0,0,0,0,0,0,0,0,0,0,0,0,0,0,0,3.57,32.14,3.57,0,25,0,0,3.57,3.57,7.14,0,0,0,0,0,0,0,0,0,0,0,0,0,0
1001,i feel honoured today olu jacobs i feel honoured today olu jacobs a href http momo,1,1,16,78.28,1.71,89.39,20.23,16,12.5,62.5,31.25,18.75,12.5,12.5,12.5,0,0,0,0,0,6.25,6.25,0,0,0,0,0,0,12.5,0,0,12.5,0,12.5,0,12.5,0,12.5,12.5,0,0,0,0,0,0,0,0,0,0,0,0,0,0,0,0,12.5,12.5,0,12.5,0,12.5,0,0,0,0,0,0,6.25,0,0,6.25,0,0,0,0,0,0,0,0,0,0,0,0,0,0,0,0,0,0,0,0,0,0,0,0,25,12.5,0,0,0,0,0,12.5,0,0,12.5,0,0,0,0,0,0,0,0,0,0,0,0,0
1002,i made some chilli oil because it s monday and i was feeling dangerous,3,1,14,2.35,1,97.09,1,14,21.43,85.71,64.29,50,21.43,14.29,14.29,0,0,0,0,7.14,7.14,0,0,0,7.14,0,14.29,0,14.29,7.14,7.14,0,0,0,0,21.43,0,21.43,7.14,14.29,0,0,0,0,0,7.14,0,7.14,0,0,0,0,0,0,0,0,0,0,0,0,0,0,0,0,0,0,0,0,0,0,0,0,0,0,0,0,0,7.14,0,0,0,0,0,0,7.14,0,0,0,0,0,0,0,0,7.14,0,0,7.14,0,0,0,0,0,7.14,7.14,14.29,0,0,0,0,0,0,0,0,0,0,0,0,0,0
1003,i started walking again yesterday and it feels amazing,1,1,9,1.78,2.75,99,99,9,44.44,100,77.78,44.44,22.22,11.11,11.11,0,0,0,0,11.11,0,0,0,0,0,11.11,11.11,0,33.33,0,0,0,0,0,0,11.11,0,11.11,11.11,0,0,0,0,0,0,11.11,11.11,0,11.11,11.11,0,0,0,0,0,0,0,0,0,0,0,0,0,0,0,0,0,0,0,0,0,0,0,0,0,0,0,0,0,0,0,0,0,0,0,0,0,0,0,0,0,0,0,0,0,0,22.22,0,11.11,0,0,0,11.11,33.33,22.22,11.11,0,0,0,0,0,0,0,0,0,0,0,0,0
1004,ive also been feeling somewhat emo irritable lately,3,1,8,1,1.71,99,1,8,37.5,100,75,62.5,12.5,12.5,12.5,0,0,0,0,0,0,0,0,0,25,37.5,12.5,0,25,0,0,0,0,0,0,25,0,25,12.5,0,0,12.5,0,0,0,25,0,12.5,25,0,12.5,0,12.5,0,0,0,0,0,0,0,0,0,0,0,0,0,0,0,0,0,0,0,0,0,0,0,0,0,0,0,0,0,0,0,0,0,0,0,0,0,0,0,0,0,0,0,12.5,0,0,0,0,0,12.5,12.5,25,0,0,12.5,12.5,0,0,0,0,0,0,0,0,0,0
1005,i felt joyful then it subsided now i feel joyful again,1,1,11,1,1,99,99,11,9.09,90.91,72.73,54.55,27.27,18.18,18.18,0,0,0,0,9.09,0,0,0,0,0,18.18,9.09,0,18.18,0,0,0,0,0,0,18.18,0,18.18,18.18,0,0,0,0,0,0,18.18,18.18,0,18.18,18.18,0,0,0,0,0,0,0,0,0,0,0,0,0,0,0,0,0,0,0,0,0,0,0,0,0,0,0,0,0,0,0,0,0,0,0,0,0,0,0,0,0,0,0,0,0,18.18,18.18,0,0,0,0,0,18.18,27.27,9.09,18.18,0,0,0,0,0,0,0,0,0,0,0,0,0
1006,i feel like i have to shy away from triggering some stereotype of a person who will scream and break things because they didnt get to eat their favorite kind of sandwich,4,1,32,62.1,40.06,32.54,69.4,32,15.63,93.75,78.13,62.5,18.75,15.63,6.25,0,0,0,6.25,3.13,9.38,3.13,0,21.88,9.38,0,6.25,3.13,21.88,6.25,3.13,0,0,0,0,18.75,0,18.75,3.13,6.25,0,6.25,0,3.13,0,3.13,3.13,0,0,0,0,0,0,0,0,15.63,3.13,0,0,0,0,0,12.5,0,0,0,0,0,0,0,0,0,0,0,0,0,0,6.25,0,0,0,0,0,0,6.25,0,6.25,0,3.13,0,0,0,0,0,0,9.38,9.38,0,0,3.13,0,3.13,3.13,0,3.13,3.13,9.38,0,0,0,0,0,0,0,0,0,0,0,0
1007,i feel completely distracted and emotionally drained,3,1,7,2.35,1,97.09,20.23,7,57.14,85.71,57.14,42.86,14.29,14.29,14.29,0,0,0,0,0,0,0,0,0,0,14.29,14.29,0,14.29,0,0,0,0,0,0,28.57,0,28.57,14.29,0,0,0,14.29,0,0,14.29,0,0,14.29,0,0,0,0,0,0,0,0,0,0,0,0,0,0,0,0,0,0,0,0,0,0,0,0,0,0,0,0,0,0,0,0,0,0,0,0,0,0,0,0,0,0,0,0,0,0,14.29,28.57,14.29,0,0,0,0,14.29,0,0,14.29,0,0,0,0,0,0,0,0,0,0,0,0,0
1008,i exhausted and feeling a little morose but now im livid on top of everything else,0,1,16,13.27,1,99,1,16,18.75,100,75,62.5,18.75,12.5,12.5,0,0,0,0,6.25,6.25,6.25,0,12.5,6.25,12.5,12.5,0,6.25,18.75,6.25,0,0,0,0,25,6.25,18.75,6.25,0,0,0,0,12.5,0,18.75,0,18.75,18.75,0,18.75,0,6.25,6.25,0,0,0,0,0,0,0,0,0,0,0,0,0,0,0,0,0,0,0,0,0,0,0,6.25,6.25,0,0,0,0,0,0,0,0,0,0,0,0,6.25,0,0,0,6.25,12.5,0,0,6.25,0,0,6.25,6.25,0,12.5,0,0,0,0,0,0,0,0,0,0,0,0,0
1009,i feel so safe and tucked away,1,1,7,2.35,1,99,99,7,0,85.71,85.71,57.14,14.29,14.29,14.29,0,0,0,0,0,0,0,0,14.29,0,14.29,28.57,0,14.29,14.29,0,0,0,0,0,14.29,0,14.29,14.29,0,0,0,0,0,0,14.29,14.29,0,0,0,0,0,0,0,0,0,0,0,0,0,0,0,0,0,0,0,0,0,0,0,0,0,0,0,0,0,0,0,0,0,0,0,0,0,0,0,0,0,0,0,0,0,0,14.29,0,28.57,28.57,0,0,14.29,0,0,14.29,0,0,14.29,0,0,0,0,0,0,0,0,0,0,0,0,0
1010,im feeling too tortured to write today,4,1,7,18.12,1,97.09,1,7,28.57,100,57.14,42.86,14.29,14.29,14.29,0,0,0,0,0,0,0,0,14.29,14.29,14.29,0,0,28.57,0,0,0,0,0,0,14.29,0,14.29,14.29,0,0,0,0,0,0,14.29,0,14.29,14.29,0,14.29,0,0,0,0,28.57,28.57,0,0,14.29,0,14.29,0,0,0,0,0,0,0,0,0,0,0,0,0,0,0,0,0,0,0,0,0,0,0,0,0,0,0,0,0,0,0,0,14.29,14.29,14.29,0,0,0,0,0,14.29,0,0,14.29,0,0,0,0,0,0,0,0,0,0,0,0,0
1011,i promise youll feel inspired afterwards,1,1,6,1,98.75,99,99,6,50,100,66.67,50,33.33,33.33,16.67,0,16.67,0,0,0,0,0,0,0,16.67,16.67,0,0,33.33,0,0,0,0,0,0,50,0,50,33.33,0,0,0,16.67,0,0,16.67,16.67,0,16.67,16.67,0,0,0,0,0,33.33,16.67,0,0,0,0,0,16.67,0,0,0,0,0,0,0,0,0,0,0,0,0,0,0,0,0,0,0,0,0,0,0,0,0,0,0,0,0,0,0,16.67,16.67,16.67,0,0,0,0,0,16.67,16.67,0,16.67,16.67,0,0,0,0,0,0,0,0,0,0,0,0
1012,i feel however i have something far more precious than feelings,1,1,11,1,1,99,99,11,36.36,100,90.91,63.64,27.27,18.18,18.18,0,0,0,0,9.09,9.09,0,0,9.09,9.09,9.09,18.18,0,18.18,27.27,9.09,0,0,0,0,45.45,0,45.45,18.18,0,0,9.09,0,18.18,0,9.09,9.09,0,0,0,0,0,0,0,0,0,0,0,0,0,0,0,0,0,0,0,0,0,0,0,0,0,0,0,0,0,0,0,0,0,0,0,0,0,0,0,0,0,0,0,0,0,0,0,0,18.18,27.27,0,0,9.09,0,0,18.18,0,0,9.09,0,0,0,0,0,0,0,0,0,0,0,0,0
1013,i feel that working together and supporting each other as a whole i can represent a larger younger voice in politics what can i say to that,2,1,27,33.38,1,52.89,99,27,22.22,92.59,85.19,62.96,22.22,11.11,11.11,0,0,0,0,11.11,22.22,7.41,0,11.11,7.41,3.7,7.41,0,22.22,14.81,7.41,11.11,7.41,0,3.7,18.52,0,18.52,3.7,0,7.41,0,0,3.7,0,7.41,7.41,0,0,0,0,0,0,0,0,11.11,11.11,7.41,0,0,0,3.7,0,0,0,0,0,3.7,3.7,0,0,7.41,0,0,7.41,0,0,0,0,0,0,0,0,0,0,0,0,0,0,0,0,0,0,0,0,3.7,7.41,0,0,3.7,0,0,3.7,3.7,0,11.11,0,0,0,0,0,0,0,0,0,0,0,0,0
1014,im alone in this apartment i get this overwhelming feeling like im being watched and that im unwelcome,0,1,18,1,1,99,1,18,27.78,94.44,83.33,66.67,38.89,22.22,22.22,0,0,0,0,16.67,16.67,0,0,11.11,22.22,5.56,5.56,0,33.33,11.11,0,0,0,0,0,5.56,0,5.56,5.56,0,0,0,0,0,0,5.56,0,5.56,5.56,0,5.56,5.56,0,0,0,5.56,0,0,0,0,0,0,0,0,0,0,0,0,0,0,0,5.56,0,5.56,0,0,0,0,0,0,0,0,0,0,0,0,0,0,5.56,0,0,0,0,0,0,11.11,22.22,5.56,0,11.11,5.56,0,5.56,0,5.56,16.67,0,0,0,0,0,0,0,0,0,0,0,0,0
1015,i feel blessed that i have people in my life who remind me all the time that i did the right thing and that i look better like this,2,1,29,5.28,1,95.69,98.26,29,3.45,100,82.76,68.97,41.38,24.14,20.69,0,0,0,0,17.24,27.59,6.9,0,6.9,6.9,0,3.45,0,13.79,6.9,3.45,3.45,0,3.45,0,10.34,3.45,6.9,3.45,0,0,0,0,0,3.45,6.9,6.9,0,0,0,0,0,0,0,0,10.34,3.45,0,0,0,0,0,3.45,0,0,0,0,0,0,0,0,3.45,0,0,0,0,3.45,0,0,0,0,0,0,0,0,0,0,0,0,0,0,0,0,0,0,31.03,10.34,3.45,0,3.45,3.45,0,3.45,0,3.45,3.45,0,0,0,0,0,0,0,0,0,0,0,0,0
1016,i had come to associate the bad feelings with bad behaviour and this only continued,0,1,15,59.67,10.48,99,1,15,26.67,93.33,80,53.33,13.33,6.67,6.67,0,0,0,0,6.67,13.33,6.67,0,13.33,6.67,6.67,6.67,0,13.33,26.67,0,6.67,6.67,0,0,6.67,0,6.67,6.67,0,0,0,0,0,0,13.33,0,13.33,13.33,0,13.33,0,0,0,0,0,0,0,0,0,0,0,0,0,0,0,0,0,0,0,0,0,0,0,0,0,0,0,0,0,0,0,0,0,0,0,0,0,0,0,0,0,0,0,0,6.67,13.33,0,6.67,6.67,0,0,6.67,6.67,6.67,0,0,0,0,0,0,0,0,0,0,0,0,0,0
1017,i feel a lot of affection for you that is longing to be conveyed,2,1,14,76.24,79.51,2.36,98.65,14,21.43,100,78.57,71.43,21.43,14.29,7.14,0,7.14,0,0,7.14,21.43,7.14,0,21.43,14.29,0,0,0,21.43,0,21.43,7.14,7.14,0,0,14.29,0,14.29,7.14,0,7.14,0,0,0,0,7.14,7.14,0,7.14,7.14,0,0,0,0,0,21.43,14.29,7.14,0,0,0,7.14,7.14,0,0,0,0,0,0,0,0,0,0,0,0,0,0,0,0,0,0,0,0,0,0,0,0,7.14,0,0,0,0,0,0,0,7.14,7.14,0,0,0,0,0,7.14,0,0,14.29,0,0,0,0,0,0,0,0,0,0,0,0,0
1018,i am and i am looking for some vest tops i have some shorts but long ones due to feel paranoid that i have cellulite everywhere,4,1,26,4.85,1,99,1,26,15.38,80.77,73.08,61.54,19.23,15.38,15.38,0,0,0,0,3.85,11.54,0,0,7.69,15.38,3.85,7.69,0,23.08,7.69,11.54,0,0,0,0,11.54,3.85,7.69,3.85,0,0,0,0,3.85,0,3.85,0,3.85,3.85,0,3.85,3.85,0,0,0,0,0,0,0,0,0,0,0,0,0,0,0,0,0,0,0,0,0,0,0,0,0,3.85,3.85,0,0,3.85,0,0,0,0,0,0,0,0,0,0,0,0,7.69,15.38,19.23,7.69,0,7.69,7.69,0,3.85,3.85,0,11.54,0,0,0,0,0,0,0,0,0,0,0,0,0
1019,i feel like it was a bit of divine intervention for me,1,1,12,89.52,1,89.39,99,12,8.33,91.67,91.67,66.67,25,16.67,16.67,0,0,0,0,8.33,8.33,8.33,0,25,8.33,0,0,0,16.67,8.33,8.33,0,0,0,0,8.33,0,8.33,8.33,0,0,0,0,0,0,8.33,8.33,0,0,0,0,0,0,0,0,0,0,0,0,0,0,0,0,0,0,0,0,0,0,0,0,0,0,0,0,0,0,0,0,0,0,0,0,0,0,0,0,0,0,0,0,0,0,0,0,16.67,8.33,0,0,0,0,0,8.33,0,8.33,8.33,0,0,0,0,0,0,0,0,0,0,0,0,0
1020,i know is that she s here and i m so thankful for her warm loving and peaceful presence i feel when my anger or feelings of discontent and frustration flare up,0,1,32,1.97,4.83,96.5,69.4,32,18.75,84.38,71.88,56.25,21.88,18.75,12.5,0,0,6.25,0,3.13,9.38,0,0,9.38,3.13,9.38,18.75,0,9.38,9.38,0,0,0,0,0,12.5,0,12.5,9.38,0,0,3.13,0,3.13,0,15.63,9.38,6.25,12.5,6.25,6.25,0,6.25,0,0,9.38,3.13,3.13,0,0,0,0,6.25,0,0,6.25,0,0,0,0,0,0,0,0,0,0,0,0,0,0,0,0,0,0,0,0,0,0,0,0,0,0,0,0,0,9.38,15.63,0,0,6.25,0,0,9.38,3.13,0,6.25,0,0,0,0,0,0,0,0,0,0,0,0,0
1021,im trying to be understanding open minded and fair but im feeling completely pissed to the max about a few things,3,1,21,29.12,1,56.69,99,21,14.29,95.24,76.19,61.9,14.29,9.52,9.52,0,0,0,0,4.76,14.29,9.52,0,14.29,14.29,9.52,9.52,0,19.05,19.05,4.76,4.76,0,4.76,0,23.81,0,23.81,9.52,0,4.76,0,4.76,4.76,0,19.05,14.29,4.76,0,0,0,0,0,0,4.76,9.52,9.52,0,0,0,9.52,0,0,0,0,0,0,0,0,0,0,0,0,0,0,0,0,4.76,0,0,0,0,0,0,0,0,0,0,0,0,0,0,0,0,9.52,0,4.76,0,0,0,0,0,4.76,0,0,9.52,0,0,0,0,0,0,0,0,0,0,0,0,0
1022,i don t know if this helps at all but writing all of this has made me feel somewhat regretful of ashamed of who i was and while i have more to share i just don t think i can right now,0,1,42,7.34,1,92.84,3.2,42,9.52,90.48,78.57,66.67,21.43,16.67,14.29,0,0,0,0,4.76,11.9,0,0,11.9,9.52,7.14,9.52,0,21.43,2.38,7.14,7.14,4.76,0,2.38,26.19,4.76,21.43,7.14,2.38,4.76,4.76,0,4.76,0,7.14,2.38,4.76,4.76,0,4.76,0,0,2.38,0,9.52,7.14,2.38,0,0,0,2.38,2.38,0,0,0,0,0,0,0,0,0,0,0,0,0,0,0,0,0,0,0,0,0,0,0,0,0,0,0,0,0,0,0,0,11.9,2.38,0,0,0,0,0,2.38,4.76,7.14,11.9,0,0,0,0,0,0,0,0,0,0,0,0,0
1023,i feel happy about this solution,1,1,6,10.19,1,99,99,6,16.67,100,83.33,50,33.33,16.67,16.67,0,0,0,0,16.67,16.67,0,0,16.67,0,16.67,0,0,16.67,16.67,0,16.67,0,16.67,0,33.33,0,33.33,33.33,0,0,0,0,0,0,16.67,16.67,0,16.67,16.67,0,0,0,0,0,0,0,0,0,0,0,0,0,0,0,0,0,0,0,0,0,0,0,0,0,0,0,0,0,0,0,0,0,0,0,0,0,0,0,0,0,0,0,0,0,16.67,16.67,0,0,0,0,0,16.67,0,0,16.67,0,0,0,0,0,0,0,0,0,0,0,0,0
1024,i did enjoy the book however and i especially liked the characters of the brothers one fired up with the detectin spirit and the other feeling skeptical but willing to back his brother in a fight,4,1,36,92.86,13.82,89.39,2.17,36,25,94.44,66.67,61.11,8.33,8.33,5.56,0,0,2.78,0,0,25,16.67,2.78,13.89,2.78,5.56,11.11,0,5.56,5.56,2.78,8.33,5.56,0,2.78,16.67,0,16.67,5.56,0,0,2.78,0,8.33,0,8.33,2.78,5.56,2.78,0,2.78,0,0,0,0,11.11,2.78,0,0,2.78,0,0,8.33,5.56,0,0,8.33,0,0,0,0,5.56,0,0,5.56,0,0,0,0,0,0,0,0,0,0,0,0,0,0,0,0,0,0,0,0,5.56,13.89,2.78,0,8.33,0,0,2.78,0,5.56,0,0,0,0,0,0,0,0,0,0,0,0,0,0
1025,im not sure if its just me who feels this way or if its everyone but tortured souls dont make for the best boyfriends,3,1,24,1,1,99,1,24,12.5,100,83.33,66.67,29.17,12.5,8.33,0,0,0,0,16.67,16.67,4.17,0,4.17,8.33,4.17,16.67,8.33,16.67,4.17,0,8.33,4.17,4.17,0,37.5,4.17,33.33,4.17,4.17,0,20.83,0,20.83,0,4.17,0,4.17,4.17,0,4.17,0,0,0,0,20.83,4.17,0,0,4.17,0,0,16.67,0,4.17,0,4.17,0,0,0,0,4.17,0,0,0,0,4.17,0,0,0,0,0,0,0,0,0,0,0,0,0,0,0,0,0,0,8.33,8.33,0,0,4.17,0,0,4.17,0,0,12.5,0,0,0,0,0,0,0,0,0,0,0,0,0
1026,i have not conducted a survey but it is quite likely that many of them feel as assaulted by onel s demons and other creators as i would have felt had the walls been covered only with eminent figures patriotic heroes and epic deeds,0,1,44,20.83,5.27,50.45,86.79,44,15.91,84.09,68.18,59.09,11.36,6.82,4.55,0,0,0,2.27,4.55,11.36,4.55,0,11.36,13.64,4.55,11.36,2.27,18.18,11.36,2.27,4.55,0,2.27,4.55,20.45,0,20.45,6.82,0,2.27,4.55,0,6.82,0,9.09,6.82,2.27,0,0,0,0,0,0,0,9.09,6.82,0,0,2.27,4.55,0,4.55,0,0,0,0,0,0,0,0,2.27,0,0,0,0,2.27,0,0,0,0,0,0,0,0,0,0,0,0,0,0,0,0,0,0,6.82,6.82,0,0,2.27,0,0,4.55,0,6.82,4.55,0,0,0,0,0,0,0,0,0,0,0,0,0
1027,i think were on a level of understanding though i still feel hes hesitant,4,1,14,7.34,1,99,1,14,14.29,100,78.57,64.29,21.43,21.43,14.29,0,0,7.14,0,0,7.14,7.14,0,14.29,14.29,14.29,7.14,0,28.57,0,0,0,0,0,0,28.57,0,28.57,21.43,0,0,0,0,7.14,0,7.14,0,7.14,7.14,0,7.14,7.14,0,0,0,7.14,0,0,0,0,0,0,7.14,0,0,0,7.14,0,0,0,0,0,0,0,0,0,0,0,0,0,0,0,0,0,0,0,0,0,0,0,0,0,0,0,0,14.29,14.29,0,0,7.14,0,0,7.14,0,7.14,14.29,0,0,0,0,0,0,0,0,0,0,0,0,0
1028,i just feel so virtuous when we go on a fieldtrip,1,1,11,1.5,86.82,99,99,11,18.18,90.91,81.82,63.64,18.18,18.18,9.09,9.09,0,0,0,0,9.09,9.09,0,9.09,0,27.27,18.18,0,18.18,0,0,9.09,9.09,0,0,9.09,0,9.09,9.09,0,0,0,0,0,0,9.09,9.09,0,0,0,0,0,0,0,0,18.18,9.09,0,0,0,9.09,0,9.09,0,0,0,0,0,0,0,0,0,0,0,0,0,0,0,0,0,0,0,0,0,0,0,0,0,0,0,0,0,0,0,0,18.18,18.18,0,9.09,9.09,0,0,9.09,9.09,0,9.09,0,0,0,0,0,0,0,0,0,0,0,0,0
1029,im not gonna lie i was kinda sad and down and feeling pretty lonely,0,1,14,1,1,99,1,14,7.14,100,85.71,64.29,14.29,14.29,14.29,0,0,0,0,0,0,0,0,14.29,21.43,7.14,14.29,7.14,21.43,21.43,0,0,0,0,0,28.57,0,28.57,7.14,0,0,14.29,0,7.14,0,14.29,0,14.29,14.29,0,14.29,0,0,14.29,0,7.14,7.14,0,0,0,0,0,0,0,0,0,0,0,0,0,0,0,0,0,0,0,0,0,0,0,0,0,0,0,0,0,0,0,0,0,0,0,0,0,0,7.14,14.29,0,0,7.14,0,0,7.14,0,7.14,7.14,7.14,14.29,14.29,0,0,0,0,0,0,0,0,0,0
1030,im feeling ecstatic about right now the classy ever after redesign project begins this week,1,1,15,22.17,10.48,99,97.84,15,26.67,86.67,60,46.67,13.33,6.67,6.67,0,0,0,0,6.67,13.33,6.67,0,13.33,6.67,20,6.67,0,13.33,0,6.67,0,0,0,0,13.33,6.67,6.67,6.67,0,0,0,0,0,0,6.67,6.67,0,6.67,6.67,0,0,0,0,0,0,0,0,0,0,0,0,0,0,0,0,0,0,0,0,0,6.67,0,0,6.67,0,0,0,0,0,0,0,0,0,0,0,0,0,0,0,0,0,0,0,0,13.33,6.67,0,0,0,0,0,6.67,33.33,0,20,0,0,0,0,0,0,0,0,0,0,0,0,0
1031,i feel could have been avoided with some blazes markers or cairns i was very annoyed at this point,3,1,19,6.22,1,33.61,1,19,15.79,78.95,73.68,63.16,15.79,10.53,10.53,0,0,0,0,5.26,10.53,0,0,10.53,21.05,5.26,5.26,0,31.58,0,5.26,0,0,0,0,15.79,0,15.79,5.26,0,5.26,5.26,0,5.26,0,5.26,0,5.26,5.26,0,5.26,0,5.26,0,0,5.26,5.26,0,0,5.26,0,0,0,0,0,0,0,0,0,0,0,0,0,0,0,0,0,0,0,0,0,0,0,0,0,0,0,0,0,0,0,0,0,5.26,0,10.53,5.26,0,0,0,0,0,5.26,0,15.79,5.26,0,0,0,0,0,0,0,0,0,0,0,0,0
1032,i never told my boyfriend or his parents and i do remember feeling embarrassed and maybe even a little ashamed,0,1,20,1,3.95,98.38,1,20,30,100,75,60,20,20,15,0,0,5,0,0,15,5,0,0,5,15,15,5,15,5,5,15,10,0,5,25,5,20,10,0,0,10,0,5,5,10,0,10,10,0,10,0,0,0,0,25,10,0,0,0,0,5,15,5,5,0,10,0,0,0,0,0,0,0,0,0,0,0,0,0,0,0,0,0,0,0,0,0,0,0,0,0,0,0,0,0,5,0,0,0,0,0,5,5,10,0,0,0,0,0,0,0,0,0,0,0,0,0,0
1033,i feel more aggravated and annoyed by their visits,3,1,9,33.38,40.06,77.17,1,9,22.22,100,66.67,55.56,22.22,22.22,11.11,0,0,0,11.11,0,22.22,0,0,11.11,0,0,11.11,0,11.11,11.11,11.11,0,0,0,0,11.11,0,11.11,11.11,0,0,0,0,0,0,22.22,0,22.22,22.22,0,22.22,0,22.22,0,0,33.33,22.22,0,0,11.11,0,0,11.11,0,0,0,0,0,0,0,0,0,0,0,0,0,0,0,0,0,0,0,0,0,0,0,0,0,0,0,0,0,0,0,0,11.11,11.11,0,0,0,0,0,11.11,0,0,11.11,0,0,0,0,0,0,0,0,0,0,0,0,0
1034,im feeling completely idiotic by not being ablo to contribute,0,1,10,15.41,1,98.38,1,10,40,90,70,60,10,10,10,0,0,0,0,0,0,0,0,20,20,10,0,10,20,10,0,0,0,0,0,30,0,30,10,0,0,0,10,10,0,10,0,10,0,0,0,0,0,0,0,10,10,10,0,0,0,0,0,0,0,0,0,0,0,0,0,0,0,0,0,0,0,0,0,0,0,0,0,0,0,0,0,0,0,0,0,0,0,0,0,0,10,0,0,0,0,0,10,0,0,10,0,0,0,0,0,0,0,0,0,0,0,0,0
1035,i aint happy im feeling glad i got sunshine in a bag im useless but not for long the future is coming on,1,1,23,23.51,1,99,84.9,23,13.04,91.3,82.61,56.52,17.39,17.39,17.39,0,0,0,0,0,8.7,8.7,0,13.04,17.39,0,4.35,8.7,26.09,17.39,4.35,0,0,0,0,17.39,0,17.39,4.35,0,0,0,0,13.04,0,13.04,8.7,4.35,8.7,8.7,0,0,0,0,0,4.35,4.35,0,0,0,4.35,0,0,0,0,0,0,0,0,0,0,0,0,0,0,0,0,0,0,0,0,0,0,0,0,0,0,0,4.35,0,0,0,0,0,0,4.35,17.39,0,4.35,13.04,0,0,4.35,4.35,0,17.39,4.35,0,0,0,0,0,0,0,0,0,0,0,0
1036,i feel strong is that i dont let the anger win,1,1,11,1.5,1,95.15,99,11,0,100,81.82,54.55,27.27,18.18,18.18,0,0,0,0,9.09,18.18,9.09,0,0,18.18,0,0,9.09,36.36,9.09,0,18.18,0,9.09,9.09,9.09,0,9.09,9.09,0,0,0,0,0,0,27.27,18.18,9.09,9.09,0,9.09,0,9.09,0,0,0,0,0,0,0,0,0,0,0,0,0,0,0,0,0,0,0,0,0,0,0,0,0,0,0,0,0,0,0,0,0,0,0,0,0,0,0,9.09,0,0,9.09,9.09,0,0,0,0,0,9.09,0,0,27.27,0,0,0,0,0,0,0,0,0,0,0,0,0
1037,i always feel so helpless during times of disaster but i feel a little better knowing that even a few dollars can make a difference for someone in need,0,1,29,68.11,3.55,99,20.23,29,20.69,96.55,89.66,58.62,13.79,6.9,6.9,0,0,0,0,6.9,17.24,10.34,0,13.79,3.45,10.34,6.9,0,20.69,13.79,10.34,6.9,0,3.45,3.45,34.48,3.45,31.03,10.34,3.45,6.9,3.45,0,6.9,0,6.9,3.45,3.45,3.45,0,3.45,0,0,0,0,3.45,0,0,0,0,0,0,3.45,0,0,0,0,0,0,0,0,3.45,0,0,0,3.45,0,0,0,0,0,0,0,0,0,0,3.45,0,0,0,0,0,0,0,0,17.24,10.34,0,0,3.45,0,0,6.9,10.34,0,10.34,0,0,0,0,0,0,0,0,0,0,0,0,0
1038,i honestly feel extremely shy to ask my friends to take pictures of me how vain must they think i am,4,1,21,18.12,4.61,97.09,1,21,19.05,95.24,85.71,57.14,23.81,23.81,19.05,0,0,0,4.76,0,4.76,0,0,14.29,9.52,9.52,0,0,28.57,9.52,0,4.76,4.76,0,0,28.57,0,28.57,14.29,4.76,4.76,0,9.52,0,0,4.76,0,4.76,0,0,0,0,0,0,0,23.81,14.29,0,0,0,4.76,4.76,9.52,0,4.76,0,0,0,0,0,0,0,0,0,0,0,0,0,0,0,0,0,0,0,0,0,4.76,0,4.76,0,0,0,0,0,0,9.52,4.76,0,0,0,0,0,4.76,0,0,9.52,0,0,0,0,0,0,0,0,0,0,0,0,0
1039,ill find that elusive second wind and feel more hopeful but today i am a href http www,1,1,18,10.19,1,77.17,93.93,18,11.11,77.78,66.67,50,16.67,11.11,11.11,0,0,0,0,5.56,22.22,5.56,5.56,0,11.11,0,11.11,0,22.22,11.11,11.11,0,0,0,0,22.22,0,22.22,11.11,0,5.56,5.56,0,5.56,0,5.56,5.56,0,5.56,5.56,0,0,0,0,0,0,0,0,0,0,0,0,0,0,0,0,0,5.56,0,0,5.56,0,0,0,0,0,0,0,0,0,0,0,0,0,0,0,0,5.56,0,0,0,0,0,0,0,16.67,11.11,0,0,0,0,0,5.56,0,0,11.11,11.11,0,0,0,0,0,0,0,0,0,0,0,0
1040,i feel intimidated nervous and overwhelmed and i shake like a leaf,4,1,12,49.68,1,89.39,1,12,25,83.33,66.67,50,16.67,16.67,16.67,0,0,0,0,0,8.33,8.33,0,8.33,0,0,16.67,0,8.33,8.33,0,8.33,0,0,8.33,8.33,0,8.33,8.33,0,0,0,0,0,0,25,0,25,16.67,0,16.67,16.67,0,0,0,0,0,0,0,0,0,0,0,0,0,0,0,0,0,0,0,0,0,0,0,0,0,0,0,0,0,0,0,0,0,0,0,0,0,0,0,0,0,0,0,16.67,8.33,0,0,0,0,0,8.33,0,0,8.33,0,0,0,0,0,0,0,0,0,0,0,0,0
1041,i make myself feel useful by fucking a guy,1,1,9,89.52,1,99,99,9,11.11,100,77.78,44.44,22.22,22.22,22.22,0,0,0,0,0,11.11,11.11,0,11.11,0,0,0,0,22.22,11.11,0,0,0,0,0,22.22,0,22.22,11.11,11.11,0,0,0,0,0,22.22,11.11,0,0,0,0,0,0,0,11.11,22.22,11.11,0,0,0,11.11,0,11.11,0,0,0,11.11,0,0,0,0,0,0,0,0,0,0,0,0,0,0,0,0,0,0,0,0,0,0,0,0,0,0,0,0,22.22,11.11,0,0,0,0,0,11.11,0,0,11.11,0,0,0,0,0,0,0,0,0,0,0,0,0
1042,i feel most inspired to create and ive been thinking a lot about inspiration this week,1,1,16,26.1,1.71,99,99,16,18.75,100,87.5,62.5,18.75,12.5,12.5,0,0,0,0,6.25,25,6.25,0,12.5,12.5,6.25,6.25,0,31.25,6.25,18.75,6.25,0,6.25,0,25,0,25,25,0,0,0,0,0,0,12.5,12.5,0,12.5,12.5,0,0,0,0,0,0,0,0,0,0,0,0,0,0,0,0,0,0,0,0,0,0,0,0,0,0,0,0,0,0,0,0,0,0,0,0,0,0,0,0,0,0,0,0,18.75,6.25,6.25,0,0,0,0,0,6.25,6.25,12.5,6.25,0,0,0,0,0,0,0,0,0,0,0,0,0
1043,i think most interactions in person are probably fine sufficiently respectful and polite that the ladies don t feel abused,0,1,20,54.7,69.2,63.35,90.5,20,20,90,65,40,10,5,5,0,0,0,0,5,15,5,0,5,5,5,5,0,15,20,5,10,0,0,10,20,0,20,10,5,0,5,0,0,0,15,10,5,0,0,0,0,0,0,0,20,15,10,15,0,0,0,10,0,0,5,0,0,0,0,0,0,0,0,0,0,0,0,0,0,0,0,0,0,0,0,0,0,0,0,5,0,0,0,0,5,10,0,0,5,0,0,5,0,0,10,0,0,0,0,0,0,0,0,0,0,0,0,0
1044,im feeling extremely fabulous with my jacket and shoes aint no bitches gonna bring me down hahah,1,1,17,3.11,1,99,99,17,23.53,88.24,76.47,58.82,17.65,17.65,17.65,0,0,0,0,0,11.76,0,0,17.65,17.65,5.88,5.88,11.76,23.53,5.88,0,0,0,0,0,23.53,5.88,17.65,5.88,0,0,0,5.88,5.88,0,17.65,11.76,0,11.76,11.76,0,0,0,0,5.88,5.88,5.88,0,0,0,0,0,0,0,0,0,0,0,0,0,0,0,0,0,0,0,0,0,0,0,0,0,0,0,0,0,0,0,0,0,0,0,0,0,0,11.76,17.65,0,5.88,5.88,0,0,5.88,0,0,11.76,5.88,11.76,11.76,0,0,0,0,0,0,0,0,0,0
1045,ive have chosen to walk with jesus and maybe im feeling a bit miserable im going to suck it up and think about these three dudes,0,1,26,21.6,7.93,94.47,1,26,7.69,96.15,88.46,61.54,19.23,11.54,11.54,0,0,0,0,7.69,11.54,3.85,3.85,19.23,15.38,7.69,7.69,0,34.62,3.85,7.69,0,0,0,0,11.54,0,11.54,7.69,0,0,3.85,0,0,0,3.85,0,3.85,3.85,0,3.85,0,0,0,0,3.85,0,0,0,0,0,0,3.85,0,3.85,0,3.85,0,0,0,0,3.85,0,0,0,0,3.85,0,0,0,0,0,0,0,0,0,0,0,0,0,0,0,0,0,0,3.85,11.54,0,3.85,3.85,0,0,3.85,0,3.85,7.69,7.69,3.85,3.85,0,0,0,0,0,0,0,0,0,0
1046,i had a good day but right now im feeling pretty irritable for no real reason meaning nothing significant happened to make me feel annoyed,3,1,25,19.3,1,99,1,25,28,100,72,48,12,12,12,0,0,0,0,0,8,4,0,8,8,8,4,8,20,16,4,0,0,0,0,40,8,32,12,12,0,4,8,4,0,12,4,8,12,4,8,0,8,0,0,4,4,0,0,4,0,0,0,0,0,0,0,0,0,0,0,0,0,0,0,0,0,0,0,0,0,0,0,0,0,0,0,0,0,0,0,0,0,0,0,32,8,0,0,0,0,0,8,8,8,12,0,0,0,0,0,0,0,0,0,0,0,0,0
1047,i am feeling contented and pissed at the same time,1,1,10,69.05,1,98.38,20.23,10,20,100,60,50,10,10,10,0,0,0,0,0,10,10,0,10,10,0,10,0,10,10,0,0,0,0,0,20,0,20,10,0,0,0,0,10,0,20,10,10,10,10,0,0,0,0,10,0,0,0,0,0,0,0,0,0,0,0,0,0,0,0,0,0,0,0,0,0,0,10,0,0,0,0,0,0,0,0,0,0,0,0,10,0,0,0,0,10,10,0,0,0,0,0,10,0,0,10,0,0,0,0,0,0,0,0,0,0,0,0,0
1048,i wonder if the homeowners would feel weird if i parked to gape at their landscaping,5,1,16,43.4,1.71,99,20.23,16,12.5,87.5,75,56.25,18.75,18.75,12.5,0,0,0,6.25,0,12.5,6.25,0,12.5,6.25,0,12.5,0,18.75,6.25,0,0,0,0,0,31.25,0,31.25,12.5,0,6.25,18.75,0,12.5,0,0,0,0,0,0,0,0,0,0,0,12.5,0,0,0,0,0,0,12.5,0,0,0,0,0,0,0,0,6.25,0,6.25,0,0,0,0,0,0,0,0,0,0,0,0,0,0,0,0,0,0,0,0,12.5,6.25,12.5,0,0,6.25,0,0,6.25,0,0,6.25,0,0,0,0,0,0,0,0,0,0,0,0,0
1049,i both feel impatience at the rate of loss and impressed at the same time,5,1,15,99,1.24,63.35,1,15,13.33,100,80,53.33,6.67,6.67,6.67,0,0,0,0,0,20,13.33,0,20,0,0,6.67,0,6.67,13.33,13.33,0,0,0,0,13.33,0,13.33,6.67,0,0,0,0,6.67,0,20,6.67,13.33,6.67,0,6.67,6.67,0,0,0,6.67,6.67,0,0,0,0,0,0,0,0,0,0,0,0,0,0,0,0,0,0,0,0,0,0,0,0,0,0,0,0,0,0,0,0,0,0,0,0,6.67,0,13.33,6.67,0,0,0,0,0,6.67,0,0,6.67,0,0,0,0,0,0,0,0,0,0,0,0,0
1050,im a big guy and ive gotten into some of the rigs that weve worked with to try them out and see what they feel like and let me tell you it was less than pleasant,1,1,36,26.1,84.23,39.59,64,36,2.78,97.22,94.44,69.44,27.78,19.44,8.33,2.78,2.78,0,5.56,8.33,13.89,5.56,0,19.44,11.11,0,11.11,0,30.56,8.33,8.33,8.33,2.78,5.56,0,8.33,0,8.33,2.78,0,2.78,0,0,2.78,0,2.78,2.78,0,2.78,2.78,0,0,0,0,0,16.67,2.78,0,0,0,0,2.78,13.89,0,0,0,2.78,0,0,0,0,2.78,0,0,2.78,0,0,0,0,0,0,0,0,0,0,0,0,0,2.78,0,0,0,0,0,0,13.89,11.11,0,0,5.56,2.78,0,2.78,0,13.89,5.56,0,0,0,0,0,0,0,0,0,0,0,0,0
